METRICA,VALORE,NOTE
Concorsi analizzati,4221,Conteggio archivio dal concorso 1 al concorso 4221
Media hit/sestina,0.40,Media numeri corretti per concorso
Hit rate >= 2,5.2%,Percentuale concorsi con almeno 2 hit
Ultimo concorso calcolato,4221,Data estrazione: 10/07/2026
Concorso successivo stimato,4222,Sestina proposta: 65 88 67 32 50 54
Sestina proposta (prossimo concorso),65 88 67 32 50 54,Calcolata sui 6 numeri con ritardo massimo
Distribuzione hit 0-6,0: 2773 | 1: 1229 | 2: 201 | 3: 16 | 4: 1 | 5: 0 | 6: 0,"Conteggio concorsi con esattamente 0, 1, 2, 3, 4, 5 o 6 hit"
