METRICA,VALORE,NOTE
Concorsi analizzati,4221,Conteggio archivio dal concorso 1 al concorso 4221
Media hit/sestina,0.39,Media numeri corretti per concorso
Hit rate >= 2,5.1%,Percentuale concorsi con almeno 2 hit
Best streak,7,Massima sequenza di concorsi con almeno 1 hit
Distribuzione hit 0-6,0: 2788 | 1: 1218 | 2: 201 | 3: 13 | 4: 0 | 5: 0 | 6: 0,"Conteggio concorsi con esattamente 0, 1, 2, 3, 4, 5 o 6 hit"
Ultimo concorso calcolato,4221,Data estrazione: 10/07/2026
Concorso successivo stimato,4222,Sestina proposta: 85 06 79 86 49 55
Sestina proposta (prossimo concorso),85 06 79 86 49 55,Calcolata su tutto lo storico disponibile
